id,title,description,category,source,publishedAt,url
1,NASA and IBM Unveil AI That Helps Scientists Forecast Solar Storms,Experts recently identified major gaps in their ability to forecast space weather. Surya aims to fill them.,technical,Gizmodo.com,2025-08-20T13:00:59Z,https://gizmodo.com/nasa-and-ibm-unveil-ai-that-helps-scientists-forecast-solar-storms-2000645123
2,'Inference whales' are breaching AI coding startup business models,"AI coding services face surging costs from heavy users, forcing startups such as Anthropic and Cursor to adjust pricing and even business models.",technical,Business Insider,2025-08-12T16:54:10Z,https://www.businessinsider.com/inference-whales-threaten-ai-coding-startups-business-model-2025-8
3,"IBM, NASA cook up AI model to predict solar tantrums","Open source Surya system promises early alerts for space weather that can fry satellites and grids
Boffins at IBM and NASA have concocted an AI model to help predict the weather, but this time it is taking on space weather that might disrupt satellites and sp…",technical,Theregister.com,2025-08-22T09:33:13Z,https://www.theregister.com/2025/08/22/nasa_ibm_surya_model/
4,Google Won’t Have to Sell Chrome Browser After All (But There’s a Catch),Google will need to share data with competitors after a ruling that it's an illegal monopoly.,industry,Gizmodo.com,2025-09-02T21:35:42Z,https://gizmodo.com/google-wont-have-to-sell-chrome-browser-after-all-but-theres-a-catch-2000652304
5,Cognition CEO Scott Wu describes the sleepless weekend that led to the Windsurf deal: 'I live for these moments',Cognition CEO Scott Wu described the whirlwind weekend that led to a deal to acquire fellow AI startup Windsurf.,industry,Business Insider,2025-08-28T14:58:38Z,https://www.businessinsider.com/cognition-ceo-scott-wu-windsurf-deal-ai-jeff-wang-google-2025-8
6,"Apple's Real AI Crisis Isn't Siri, But the Talent It's Losing to Rivals","Apple has hemorrhaged around a dozen artificial intelligence staff to rivals since January, making it one of the prime victims in Silicon Valley's fierce AI talent war, reports the Financial Times.





The exodus of staff from Apple's AI team over the last s…",industry,MacRumors,2025-08-07T12:22:34Z,https://www.macrumors.com/2025/08/07/apples-ai-problem-not-just-siri-talent-leaving/
7,Parallel AI Agents Are a Game Changer,"I’ve been in this industry long enough to watch technologies come and go. I’ve
seen the excitement around new frameworks, the promises of revolutionary...",applications,Morningcoffee.io,2025-09-02T22:44:50Z,https://morningcoffee.io/parallel-ai-agents-are-a-game-changer.html
8,A Software Development Methodology for Disciplined LLM Collaboration,"This methodology provides a structured approach for collaborating with AI systems on software development projects. It addresses common issues like code bloat, architectural drift, and context dilu...",applications,Github.com,2025-09-06T10:47:57Z,https://github.com/Varietyz/Disciplined-AI-Software-Development
9,AI models need a virtual machine,"Neural networks are more useful when placed in a suitable, specialized environment.",applications,Sigplan.org,2025-08-30T13:25:39Z,https://blog.sigplan.org/2025/08/29/ai-models-need-a-virtual-machine/
10,"AI will augment high-skilled jobs but hit clerical work hardest, Australia's government predicts","Australia's labor market report forecasts generative AI will automate clerical jobs but augment high-skill roles, like managers and educators.",economic,Business Insider,2025-08-14T12:28:23Z,https://www.businessinsider.com/gen-ai-automate-clerical-work-augment-high-skill-roles-report-2025-8
11,The Evidence That AI Is Destroying Jobs for Young People Just Got Stronger,"A big nerd debate with bigger implications for the future of work, technology, and the economy",economic,Derekthompson.org,2025-09-03T23:07:36Z,https://www.derekthompson.org/p/the-evidence-that-ai-is-destroying
12,"AI Data Centers Are Massive, Energy-Hungry and Headed Your Way","Behind your ChatGPT and Gemini queries, there's a land grab happening to keep up the fevered pace of gen AI's growth. The consequences are significant.",economic,CNET,2025-08-13T12:00:18Z,https://www.cnet.com/tech/services-and-software/features/ai-data-centers-are-massive-energy-hungry-and-headed-your-way/
13,Nvidia’s Six-Word Response to China,"Just days after securing a controversial deal to re-enter the Chinese market, the AI giant is on the defensive, forcefully denying accusations from Beijing that its chips are a tool for espionage.",infrastructure,Gizmodo.com,2025-08-11T20:16:50Z,https://gizmodo.com/nvidias-six-word-response-to-china-2000641571
14,Intel stock jumps on report Trump admin. is considering stake,Shares of Intel (INTC) jumped 7% following a Bloomberg report that the Trump administration is considering taking a stake in the chip giant. The report...,infrastructure,Yahoo Entertainment,2025-08-14T20:09:47Z,https://finance.yahoo.com/video/intel-stock-jumps-report-trump-200947477.html
15,Broadcom admits it’s sold a lot of shelfware to VMware customers,"Lands a fourth giant customer for bespoke AI accelerators
Broadcom has impressed investors by posting record revenues but admitted it has sold a lot of shelfware to VMware customers.…",infrastructure,Theregister.com,2025-09-05T06:01:18Z,https://www.theregister.com/2025/09/05/broadcom_q3_2025/
16,NASA and IBM Unveil AI That Helps Scientists Forecast Solar Storms,Experts recently identified major gaps in their ability to forecast space weather. Surya aims to fill them.,technical,Gizmodo.com,2025-08-20T13:00:59Z,https://gizmodo.com/nasa-and-ibm-unveil-ai-that-helps-scientists-forecast-solar-storms-2000645123
17,'Inference whales' are breaching AI coding startup business models,"AI coding services face surging costs from heavy users, forcing startups such as Anthropic and Cursor to adjust pricing and even business models.",technical,Business Insider,2025-08-12T16:54:10Z,https://www.businessinsider.com/inference-whales-threaten-ai-coding-startups-business-model-2025-8
18,"IBM, NASA cook up AI model to predict solar tantrums","Open source Surya system promises early alerts for space weather that can fry satellites and grids
Boffins at IBM and NASA have concocted an AI model to help predict the weather, but this time it is taking on space weather that might disrupt satellites and sp…",technical,Theregister.com,2025-08-22T09:33:13Z,https://www.theregister.com/2025/08/22/nasa_ibm_surya_model/
19,Model intelligence is no longer the constraint for automation,Why automation lags even as models get better,technical,Substack.com,2025-08-15T14:44:49Z,https://latentintent.substack.com/p/model-intelligence-is-no-longer-the
20,Claude for Chrome,"Anthropic is an AI safety and research company that's working to build reliable, interpretable, and steerable AI systems.",technical,Anthropic.com,2025-08-26T19:01:56Z,https://www.anthropic.com/news/claude-for-chrome
